id,giver_user_id,receiver_user_id,rating,feedback_text,created_at,updated_at
168,167,20,4,Few light suggest some nation interesting mother kind appear own threat suffer major.,2025-04-20 16:46:20.373266+00:00,2025-04-20 16:46:20.373266+00:00
169,34,63,5,Theory add help walk author development thank very benefit.,2025-04-20 16:46:20.373282+00:00,2025-04-20 16:46:20.373283+00:00
170,157,90,5,Possible local agency sign long able above option.,2025-04-20 16:46:20.373299+00:00,2025-04-20 16:46:20.373299+00:00
171,16,163,3,Truth could need toward figure position environment task nice interesting political gas bit strong inside.,2025-04-20 16:46:20.373316+00:00,2025-04-20 16:46:20.373317+00:00
172,131,4,3,Physical energy second particularly manage company answer article whose million parent gun happen entire.,2025-04-20 16:46:20.373333+00:00,2025-04-20 16:46:20.373334+00:00
173,55,157,2,The guess sort apply together open chair pressure agree prove yard teacher report hear.,2025-04-20 16:46:20.373350+00:00,2025-04-20 16:46:20.373351+00:00
174,140,77,3,Attack true attack soldier trouble break newspaper rise television.,2025-04-20 16:46:20.373368+00:00,2025-04-20 16:46:20.373368+00:00
175,172,82,5,Technology fear little there out line easy board car area week.,2025-04-20 16:46:20.373387+00:00,2025-04-20 16:46:20.373388+00:00
176,68,3,3,Baby keep effect oil music skill interesting real.,2025-04-20 16:46:20.373404+00:00,2025-04-20 16:46:20.373404+00:00
177,18,6,1,Full effect likely through law tonight particularly think reflect leader everything reflect page value start something.,2025-04-20 16:46:20.373421+00:00,2025-04-20 16:46:20.373421+00:00
178,199,183,2,Economic half role large describe strategy stay whole dream significant.,2025-04-20 16:46:20.373437+00:00,2025-04-20 16:46:20.373438+00:00
179,28,135,1,Wind hear listen probably across reason raise though remain pay reason part certainly figure understand.,2025-04-20 16:46:20.373458+00:00,2025-04-20 16:46:20.373459+00:00
180,30,47,4,Address visit traditional official commercial probably stop computer voice man statement medical production.,2025-04-20 16:46:20.373476+00:00,2025-04-20 16:46:20.373476+00:00
181,4,37,3,Close maybe field rule almost offer agreement effect product owner close often six.,2025-04-20 16:46:20.373492+00:00,2025-04-20 16:46:20.373493+00:00
182,33,111,1,Hospital say away professional able until second success situation.,2025-04-20 16:46:20.373509+00:00,2025-04-20 16:46:20.373509+00:00
183,187,13,5,Say front resource both foreign continue back side stop Democrat perhaps particularly.,2025-04-20 16:46:20.373526+00:00,2025-04-20 16:46:20.373526+00:00
184,100,36,2,Spring research main figure no every enjoy old.,2025-04-20 16:46:20.373545+00:00,2025-04-20 16:46:20.373545+00:00
185,74,141,3,Same almost let well child feel parent analysis claim ago major.,2025-04-20 16:46:20.373562+00:00,2025-04-20 16:46:20.373562+00:00
186,59,25,1,Question page although mean physical reality serve now unit.,2025-04-20 16:46:20.373578+00:00,2025-04-20 16:46:20.373579+00:00
187,172,40,3,Particularly blue night including religious sea likely American find pull month.,2025-04-20 16:46:20.373596+00:00,2025-04-20 16:46:20.373596+00:00
188,52,27,5,Expert vote people term effort different discussion available history girl professor.,2025-04-20 16:46:20.373612+00:00,2025-04-20 16:46:20.373613+00:00
189,195,9,5,Professor unit resource beyond ten keep south pick case ago force.,2025-04-20 16:46:20.373629+00:00,2025-04-20 16:46:20.373629+00:00
190,147,195,3,Sing remember town car drug short tax shoulder whole.,2025-04-20 16:46:20.373645+00:00,2025-04-20 16:46:20.373646+00:00
191,184,142,5,Physical watch possible themselves evening bar participant.,2025-04-20 16:46:20.373662+00:00,2025-04-20 16:46:20.373662+00:00
192,69,76,5,Measure war fill describe issue city general bank consider.,2025-04-20 16:46:20.373678+00:00,2025-04-20 16:46:20.373678+00:00
193,100,178,4,Three Mr wrong when today certain season itself resource middle challenge.,2025-04-20 16:46:20.373695+00:00,2025-04-20 16:46:20.373695+00:00
194,83,41,1,Bill a fly machine gas chance thought message course success try from.,2025-04-20 16:46:20.373712+00:00,2025-04-20 16:46:20.373712+00:00
195,73,172,2,Should institution there low heavy positive pull threat listen fly ten.,2025-04-20 16:46:20.373728+00:00,2025-04-20 16:46:20.373729+00:00
196,40,133,1,To simple none call rather many energy goal citizen our ten about former.,2025-04-20 16:46:20.373745+00:00,2025-04-20 16:46:20.373746+00:00
197,168,68,3,Number hot if television guy entire really myself.,2025-04-20 16:46:20.373761+00:00,2025-04-20 16:46:20.373762+00:00
198,86,185,3,Strategy another rather director charge husband now.,2025-04-20 16:46:20.373781+00:00,2025-04-20 16:46:20.373781+00:00
199,146,8,3,Method animal him when year consumer door.,2025-04-20 16:46:20.373797+00:00,2025-04-20 16:46:20.373797+00:00
200,5,154,1,Study plant voice human sport out summer over account truth beautiful.,2025-04-20 16:46:20.373813+00:00,2025-04-20 16:46:20.373814+00:00
201,99,59,2,Follow painting college walk time whether interesting down ago behind he shoulder history kid guess fear.,2025-04-20 16:46:20.373831+00:00,2025-04-20 16:46:20.373831+00:00
202,17,49,3,Wide approach be ask building by set hospital worry hold civil room administration Mrs.,2025-04-20 16:46:20.373848+00:00,2025-04-20 16:46:20.373849+00:00
203,18,63,2,She three base cut ability think sea base stage last great grow.,2025-04-20 16:46:20.373865+00:00,2025-04-20 16:46:20.373865+00:00
204,140,59,3,Or service center follow only might remain.,2025-04-20 16:46:20.373881+00:00,2025-04-20 16:46:20.373882+00:00
205,81,139,1,Level sometimes season organization such movie so message.,2025-04-20 16:46:20.373897+00:00,2025-04-20 16:46:20.373898+00:00
206,194,68,2,Charge subject effect charge chair build magazine apply.,2025-04-20 16:46:20.373914+00:00,2025-04-20 16:46:20.373914+00:00
207,36,86,1,Condition spend family another food movement above defense light member fight PM husband.,2025-04-20 16:46:20.373931+00:00,2025-04-20 16:46:20.373932+00:00
208,1,76,4,Show training them score could level suggest poor marriage treatment nation young save certain.,2025-04-20 16:46:20.373948+00:00,2025-04-20 16:46:20.373949+00:00
209,29,23,2,Consider difference machine environmental defense fact other.,2025-04-20 16:46:20.373964+00:00,2025-04-20 16:46:20.373965+00:00
210,144,51,3,Since and front ask statement strong require.,2025-04-20 16:46:20.373980+00:00,2025-04-20 16:46:20.373981+00:00
211,177,90,3,Mrs reason rich author last million manage never cause economy popular cut opportunity suddenly because some.,2025-04-20 16:46:20.374001+00:00,2025-04-20 16:46:20.374002+00:00
212,194,1,5,Enjoy economy story fund one open down they huge particular in reality outside catch deep.,2025-04-20 16:46:20.374019+00:00,2025-04-20 16:46:20.374019+00:00
213,175,131,4,Show share my police position letter computer wear activity not necessary before thing.,2025-04-20 16:46:20.374035+00:00,2025-04-20 16:46:20.374036+00:00
214,174,163,1,Though imagine line record because ahead Mr baby remain by include evening seem suggest break.,2025-04-20 16:46:20.374053+00:00,2025-04-20 16:46:20.374053+00:00
215,139,89,2,Large kind him too throw memory brother trade beyond.,2025-04-20 16:46:20.374069+00:00,2025-04-20 16:46:20.374070+00:00
216,60,158,5,Half social soldier back morning now best expert edge.,2025-04-20 16:46:20.374086+00:00,2025-04-20 16:46:20.374086+00:00
217,123,104,2,Decide case party arm that indeed those international company.,2025-04-20 16:46:20.374105+00:00,2025-04-20 16:46:20.374106+00:00
218,82,103,5,This plant week power start place camera international executive long gun former.,2025-04-20 16:46:20.374125+00:00,2025-04-20 16:46:20.374126+00:00
219,44,12,3,Wind look recently unit check really skill behavior.,2025-04-20 16:46:20.374142+00:00,2025-04-20 16:46:20.374142+00:00
220,47,115,3,Reach quickly manage check two able his identify tend mean option she.,2025-04-20 16:46:20.374158+00:00,2025-04-20 16:46:20.374159+00:00
221,76,180,2,Worry trouble hair else step kind gun fly go plant economy seem energy.,2025-04-20 16:46:20.374175+00:00,2025-04-20 16:46:20.374176+00:00
222,60,93,3,Assume through thank serious arrive almost face give front church administration beat experience sell.,2025-04-20 16:46:20.374192+00:00,2025-04-20 16:46:20.374193+00:00
223,44,177,2,My include lot return how still election open major old hope pattern bank war.,2025-04-20 16:46:20.374209+00:00,2025-04-20 16:46:20.374210+00:00
224,91,132,1,Rule alone consider beyond collection heart painting us woman heart bring similar force.,2025-04-20 16:46:20.374226+00:00,2025-04-20 16:46:20.374227+00:00
225,182,32,2,Brother place individual certain hair long type.,2025-04-20 16:46:20.374243+00:00,2025-04-20 16:46:20.374243+00:00
226,97,14,5,Although record real us long or hear understand expert again visit understand most.,2025-04-20 16:46:20.374262+00:00,2025-04-20 16:46:20.374263+00:00
227,107,176,2,American and discussion material notice none toward inside talk those well within.,2025-04-20 16:46:20.374279+00:00,2025-04-20 16:46:20.374280+00:00
228,163,156,3,Realize goal name conference office realize buy so.,2025-04-20 16:46:20.374296+00:00,2025-04-20 16:46:20.374296+00:00
229,112,58,4,Majority raise ahead bar agent painting gas difficult quality score size themselves matter detail sometimes.,2025-04-20 16:46:20.374313+00:00,2025-04-20 16:46:20.374314+00:00
230,77,126,2,Laugh technology market cell catch later yard whom attention.,2025-04-20 16:46:20.374330+00:00,2025-04-20 16:46:20.374330+00:00
231,185,180,3,Yeah important film cultural range unit good military into amount meet campaign show civil church important.,2025-04-20 16:46:20.374347+00:00,2025-04-20 16:46:20.374347+00:00
232,8,143,1,Seat season board final place tough third attention life organization buy finish war likely behavior manager.,2025-04-20 16:46:20.374365+00:00,2025-04-20 16:46:20.374365+00:00
233,16,112,3,Top miss research else card local big face bill than stop state success Congress.,2025-04-20 16:46:20.374381+00:00,2025-04-20 16:46:20.374382+00:00
234,27,186,3,Two decade now check ahead student start.,2025-04-20 16:46:20.374398+00:00,2025-04-20 16:46:20.374398+00:00
235,193,112,1,Son after might everyone center money sea team level act.,2025-04-20 16:46:20.374414+00:00,2025-04-20 16:46:20.374415+00:00
236,40,154,1,Treatment oil finish who all pretty parent return customer start wife former.,2025-04-20 16:46:20.374431+00:00,2025-04-20 16:46:20.374431+00:00
237,68,117,3,Really performance yeah type animal shake arm assume social number when wall under beat turn suggest.,2025-04-20 16:46:20.374450+00:00,2025-04-20 16:46:20.374451+00:00
238,74,145,2,Pm professional travel defense by make collection position positive.,2025-04-20 16:46:20.374467+00:00,2025-04-20 16:46:20.374467+00:00
239,98,65,5,Order build learn establish series character more into ready another office.,2025-04-20 16:46:20.374483+00:00,2025-04-20 16:46:20.374484+00:00
240,4,198,3,Teach contain finish out live big couple alone same continue project speech.,2025-04-20 16:46:20.374500+00:00,2025-04-20 16:46:20.374500+00:00
241,38,194,3,Unit idea season president beautiful radio people establish control agent loss produce significant week attention than.,2025-04-20 16:46:20.374517+00:00,2025-04-20 16:46:20.374517+00:00
242,148,110,1,They day particular authority see because them sit office what garden small beyond agreement.,2025-04-20 16:46:20.374534+00:00,2025-04-20 16:46:20.374534+00:00
243,50,154,5,Me own sit take other trip pull exist particular.,2025-04-20 16:46:20.374550+00:00,2025-04-20 16:46:20.374550+00:00
244,119,117,2,If manage world practice study future have various little hope lawyer type project sense easy.,2025-04-20 16:46:20.374567+00:00,2025-04-20 16:46:20.374567+00:00
245,198,53,3,Purpose painting tree reason offer or decade toward stock people.,2025-04-20 16:46:20.374584+00:00,2025-04-20 16:46:20.374584+00:00
246,172,46,5,Mission need party simply hospital pull bit whom whose high model.,2025-04-20 16:46:20.374600+00:00,2025-04-20 16:46:20.374601+00:00
247,20,126,5,Computer among health necessary about above describe only total agreement so letter pass.,2025-04-20 16:46:20.374617+00:00,2025-04-20 16:46:20.374618+00:00
248,194,160,5,Rather mother environmental itself next news environmental everything why scene then commercial his eye air carry.,2025-04-20 16:46:20.374634+00:00,2025-04-20 16:46:20.374635+00:00
249,34,175,1,The raise wide number course his yeah they culture story.,2025-04-20 16:46:20.374651+00:00,2025-04-20 16:46:20.374652+00:00
250,166,66,1,With rock standard better if mean despite.,2025-04-20 16:46:20.374671+00:00,2025-04-20 16:46:20.374671+00:00
251,122,101,3,Especially fine third which go month market miss seek summer order rich result born.,2025-04-20 16:46:20.374688+00:00,2025-04-20 16:46:20.374688+00:00
252,100,38,2,Debate always light apply use available agency number.,2025-04-20 16:46:20.374704+00:00,2025-04-20 16:46:20.374705+00:00
253,5,26,5,Around raise parent space value story anything company mention exist book six certain back make.,2025-04-20 16:46:20.374722+00:00,2025-04-20 16:46:20.374722+00:00
254,71,70,1,Finally task fill light then brother or popular service similar push instead.,2025-04-20 16:46:20.374739+00:00,2025-04-20 16:46:20.374739+00:00
255,136,117,5,Explain usually while measure national art better sign wait official firm because nearly pass finish television.,2025-04-20 16:46:20.374756+00:00,2025-04-20 16:46:20.374757+00:00
256,45,26,1,Official trade Mrs simply establish thing democratic system none spend among road.,2025-04-20 16:46:20.374773+00:00,2025-04-20 16:46:20.374773+00:00
257,139,177,3,Field modern difficult evidence water recently morning seven large why human so.,2025-04-20 16:46:20.374794+00:00,2025-04-20 16:46:20.374795+00:00
258,34,78,4,Effort identify religious quickly member create Republican.,2025-04-20 16:46:20.374811+00:00,2025-04-20 16:46:20.374811+00:00
259,60,43,3,And involve teach similar blood task ago save raise son drop number.,2025-04-20 16:46:20.374828+00:00,2025-04-20 16:46:20.374828+00:00
260,2,35,2,Produce fact follow believe girl table theory miss main.,2025-04-20 16:46:20.374848+00:00,2025-04-20 16:46:20.374848+00:00
261,16,63,5,Training star collection include these father image girl.,2025-04-20 16:46:20.374864+00:00,2025-04-20 16:46:20.374865+00:00
262,173,23,3,Drug sign lay agent church letter clearly rest world others.,2025-04-20 16:46:20.374881+00:00,2025-04-20 16:46:20.374882+00:00
263,198,112,2,Less table represent fine enter prove end which meet that campaign full within support five card.,2025-04-20 16:46:20.374899+00:00,2025-04-20 16:46:20.374899+00:00
264,99,193,2,Activity boy research protect such discover professional easy attention ready best her hit pass eye weight.,2025-04-20 16:46:20.374916+00:00,2025-04-20 16:46:20.374917+00:00
265,152,157,2,Nature ahead imagine condition also society relationship attack.,2025-04-20 16:46:20.374933+00:00,2025-04-20 16:46:20.374933+00:00
266,31,84,1,The develop direction task life question politics history air include season throw kind condition glass.,2025-04-20 16:46:20.374950+00:00,2025-04-20 16:46:20.374950+00:00
267,181,78,4,Form throughout task until billion between child six.,2025-04-20 16:46:20.374967+00:00,2025-04-20 16:46:20.374967+00:00
268,83,130,3,Local public apply break song final hour class difficult.,2025-04-20 16:46:20.374983+00:00,2025-04-20 16:46:20.374984+00:00
269,92,139,5,Past force customer yeah wear idea loss send happen under possible.,2025-04-20 16:46:20.375000+00:00,2025-04-20 16:46:20.375000+00:00
270,185,25,2,Upon administration such save government piece price way per truth last feel field environmental.,2025-04-20 16:46:20.375017+00:00,2025-04-20 16:46:20.375018+00:00
271,5,67,3,Cold natural provide development although attention easy city continue room leader affect determine cultural say.,2025-04-20 16:46:20.375034+00:00,2025-04-20 16:46:20.375035+00:00
272,69,167,2,Family alone cover gun her claim management guy young single ask week everything from service.,2025-04-20 16:46:20.375052+00:00,2025-04-20 16:46:20.375052+00:00
273,168,182,4,Nature at a billion resource structure writer affect person very economy condition represent another.,2025-04-20 16:46:20.375069+00:00,2025-04-20 16:46:20.375069+00:00
274,170,108,5,Hour less cup five real on reason couple job major here after.,2025-04-20 16:46:20.375085+00:00,2025-04-20 16:46:20.375086+00:00
275,110,30,4,Measure half rich various follow attorney laugh another.,2025-04-20 16:46:20.375102+00:00,2025-04-20 16:46:20.375102+00:00
276,38,94,1,Least agency mind production material senior enjoy serious director during compare.,2025-04-20 16:46:20.375121+00:00,2025-04-20 16:46:20.375122+00:00
277,87,138,2,Agree notice happy enough point someone according chair really style.,2025-04-20 16:46:20.375141+00:00,2025-04-20 16:46:20.375142+00:00
278,143,140,5,Society degree box third since key figure success over material effect push street down audience baby.,2025-04-20 16:46:20.375159+00:00,2025-04-20 16:46:20.375159+00:00
279,106,164,3,Several role put present agree oil break opportunity result challenge interview shake machine return likely popular.,2025-04-20 16:46:20.375176+00:00,2025-04-20 16:46:20.375177+00:00
280,63,157,4,News we seven consumer choice discover by pull crime forget than claim outside remain teacher.,2025-04-20 16:46:20.375193+00:00,2025-04-20 16:46:20.375194+00:00
281,83,183,1,Treatment wrong black rather soldier project education even green.,2025-04-20 16:46:20.375211+00:00,2025-04-20 16:46:20.375211+00:00
282,136,173,5,Magazine middle thing director operation half decide standard baby.,2025-04-20 16:46:20.375227+00:00,2025-04-20 16:46:20.375228+00:00
283,61,133,5,Radio kitchen different thought minute detail event study face movement necessary full sing degree own specific.,2025-04-20 16:46:20.375245+00:00,2025-04-20 16:46:20.375245+00:00
284,51,144,2,Develop response his attention brother involve article certainly human scene consider town.,2025-04-20 16:46:20.375262+00:00,2025-04-20 16:46:20.375262+00:00
285,48,129,1,Own news road development choose short enough performance movie.,2025-04-20 16:46:20.375278+00:00,2025-04-20 16:46:20.375279+00:00
286,194,196,2,Tell sense agreement summer across whatever issue expert law operation only information place garden peace.,2025-04-20 16:46:20.375295+00:00,2025-04-20 16:46:20.375296+00:00
287,17,186,4,Idea media term result there child investment anything third.,2025-04-20 16:46:20.375311+00:00,2025-04-20 16:46:20.375312+00:00
288,181,18,1,Itself miss force course after others speech open possible adult suddenly never individual impact happen.,2025-04-20 16:46:20.375328+00:00,2025-04-20 16:46:20.375329+00:00
289,99,185,5,Despite establish certainly sing eye heart establish every.,2025-04-20 16:46:20.375345+00:00,2025-04-20 16:46:20.375345+00:00
290,165,114,2,Animal adult sing safe now yourself place central decide degree student evidence discuss.,2025-04-20 16:46:20.375362+00:00,2025-04-20 16:46:20.375362+00:00
291,92,99,1,High truth stuff vote meet strategy base board game answer board.,2025-04-20 16:46:20.375378+00:00,2025-04-20 16:46:20.375379+00:00
292,186,107,3,Politics open learn firm worker network camera factor people.,2025-04-20 16:46:20.375395+00:00,2025-04-20 16:46:20.375395+00:00
293,3,83,2,Since beyond same series again respond ever air participant new song center along ball call.,2025-04-20 16:46:20.375412+00:00,2025-04-20 16:46:20.375412+00:00
294,33,6,5,Work only food meet live position physical place debate happen.,2025-04-20 16:46:20.375428+00:00,2025-04-20 16:46:20.375429+00:00
295,31,151,5,Statement food choice about environmental with Democrat machine feeling college full hear reduce wind eye.,2025-04-20 16:46:20.375446+00:00,2025-04-20 16:46:20.375446+00:00
296,29,86,3,World morning hope fire player yourself administration determine special party offer.,2025-04-20 16:46:20.375466+00:00,2025-04-20 16:46:20.375466+00:00
297,18,56,2,Lose nice second air item week yard product argue black possible which.,2025-04-20 16:46:20.375483+00:00,2025-04-20 16:46:20.375483+00:00
298,163,107,1,Address sell eye soldier meet describe bad possible.,2025-04-20 16:46:20.375499+00:00,2025-04-20 16:46:20.375500+00:00
299,49,169,1,Hard present else rate accept executive president democratic cause performance customer happy century.,2025-04-20 16:46:20.375518+00:00,2025-04-20 16:46:20.375519+00:00
300,40,188,4,Letter must film old thus a really him.,2025-04-20 16:46:20.375535+00:00,2025-04-20 16:46:20.375536+00:00
