id,giver_user_id,receiver_user_id,rating,feedback_text,created_at,updated_at
1,66,137,3,Argue eye rock generation likely property instead if know floor spring eight religious address.,2025-04-20 16:46:20.370348+00:00,2025-04-20 16:46:20.370349+00:00
2,123,124,5,Professor for give American until energy yet since statement for surface him dream show all push.,2025-04-20 16:46:20.370374+00:00,2025-04-20 16:46:20.370375+00:00
3,159,138,5,Character it big her meet there blood grow.,2025-04-20 16:46:20.370395+00:00,2025-04-20 16:46:20.370396+00:00
4,87,115,4,Focus watch technology money road across understand evidence college special adult.,2025-04-20 16:46:20.370414+00:00,2025-04-20 16:46:20.370414+00:00
5,23,40,1,Reality seat option assume campaign sort human almost really across travel.,2025-04-20 16:46:20.370435+00:00,2025-04-20 16:46:20.370436+00:00
6,190,123,4,City brother determine second help degree gun thousand whom treatment billion the mention.,2025-04-20 16:46:20.370453+00:00,2025-04-20 16:46:20.370454+00:00
7,65,200,3,Law consider history ten catch world artist spend mission team eye actually deep.,2025-04-20 16:46:20.370471+00:00,2025-04-20 16:46:20.370471+00:00
8,53,179,2,Challenge agent race adult art fund whatever impact TV into necessary matter.,2025-04-20 16:46:20.370488+00:00,2025-04-20 16:46:20.370489+00:00
9,157,113,4,Could man model benefit feel many certain across matter thank positive would read including write nor.,2025-04-20 16:46:20.370506+00:00,2025-04-20 16:46:20.370507+00:00
10,73,137,4,Source simply together sing near main senior enough various high fact shake.,2025-04-20 16:46:20.370524+00:00,2025-04-20 16:46:20.370524+00:00
11,163,119,3,Chance not actually people might behavior certain must force me activity become.,2025-04-20 16:46:20.370541+00:00,2025-04-20 16:46:20.370542+00:00
12,76,70,5,Analysis part response use buy president outside at art argue.,2025-04-20 16:46:20.370558+00:00,2025-04-20 16:46:20.370559+00:00
13,133,178,5,Should draw discuss piece whom check of.,2025-04-20 16:46:20.370575+00:00,2025-04-20 16:46:20.370575+00:00
14,67,173,4,In group quality various say boy opportunity forget health.,2025-04-20 16:46:20.370592+00:00,2025-04-20 16:46:20.370592+00:00
15,158,124,1,Service check three would see throughout work crime identify series other approach some opportunity law.,2025-04-20 16:46:20.370609+00:00,2025-04-20 16:46:20.370610+00:00
16,57,114,4,Source evidence wind participant room city happen a thought serious success college attention.,2025-04-20 16:46:20.370626+00:00,2025-04-20 16:46:20.370627+00:00
17,88,63,1,Responsibility shake single ready information many own.,2025-04-20 16:46:20.370643+00:00,2025-04-20 16:46:20.370643+00:00
18,94,37,3,No hand watch increase stuff win maintain international responsibility environmental adult.,2025-04-20 16:46:20.370660+00:00,2025-04-20 16:46:20.370660+00:00
19,199,34,4,Himself future go among degree risk produce then once hospital represent exactly act challenge realize center.,2025-04-20 16:46:20.370677+00:00,2025-04-20 16:46:20.370677+00:00
20,50,178,2,Data about poor her these field them step management.,2025-04-20 16:46:20.370694+00:00,2025-04-20 16:46:20.370694+00:00
21,118,39,3,A grow boy total day story though home central go establish baby example where resource kid.,2025-04-20 16:46:20.370711+00:00,2025-04-20 16:46:20.370712+00:00
22,191,137,4,Significant lawyer body product good good myself near truth field.,2025-04-20 16:46:20.370728+00:00,2025-04-20 16:46:20.370729+00:00
23,137,123,2,Region could voice meeting whose ready view.,2025-04-20 16:46:20.370748+00:00,2025-04-20 16:46:20.370749+00:00
24,113,107,1,Hand save move authority best key right south science.,2025-04-20 16:46:20.370765+00:00,2025-04-20 16:46:20.370765+00:00
25,80,141,3,Business current away little may where moment unit despite note board.,2025-04-20 16:46:20.370785+00:00,2025-04-20 16:46:20.370786+00:00
26,120,147,1,Story arm fish magazine same day meet night may director though move few series.,2025-04-20 16:46:20.370804+00:00,2025-04-20 16:46:20.370805+00:00
27,121,35,2,Artist treatment from clearly best development offer card.,2025-04-20 16:46:20.370821+00:00,2025-04-20 16:46:20.370822+00:00
28,46,147,5,Light bed respond for list game scene.,2025-04-20 16:46:20.370838+00:00,2025-04-20 16:46:20.370838+00:00
29,35,116,4,Sister easy night receive clearly fill break information memory size goal mind major west middle rise.,2025-04-20 16:46:20.370855+00:00,2025-04-20 16:46:20.370856+00:00
30,96,85,4,Whether along ever view action take often last.,2025-04-20 16:46:20.370871+00:00,2025-04-20 16:46:20.370872+00:00
31,105,182,5,Deep building page film husband marriage happy over stand choice huge throughout so week above.,2025-04-20 16:46:20.370888+00:00,2025-04-20 16:46:20.370889+00:00
32,188,53,3,Throughout owner church ever often dog window result remember everything scene than audience party account.,2025-04-20 16:46:20.370906+00:00,2025-04-20 16:46:20.370906+00:00
33,10,193,2,Ago begin single best bank newspaper data I campaign.,2025-04-20 16:46:20.370924+00:00,2025-04-20 16:46:20.370924+00:00
34,43,49,5,For truth stock state here man state court focus cultural recognize.,2025-04-20 16:46:20.370940+00:00,2025-04-20 16:46:20.370941+00:00
35,146,105,3,Term evidence himself plan after recent start during.,2025-04-20 16:46:20.370958+00:00,2025-04-20 16:46:20.370958+00:00
36,108,152,4,Whom another knowledge pattern Mrs control to foot sister structure lay team skill travel such vote.,2025-04-20 16:46:20.370975+00:00,2025-04-20 16:46:20.370975+00:00
37,68,11,2,Knowledge writer fly phone check because new and three successful goal there happen put cultural end.,2025-04-20 16:46:20.370992+00:00,2025-04-20 16:46:20.370993+00:00
38,81,28,1,Standard visit form sometimes no particular positive prove.,2025-04-20 16:46:20.371009+00:00,2025-04-20 16:46:20.371009+00:00
39,100,7,4,One exactly third actually population different season opportunity rather no.,2025-04-20 16:46:20.371025+00:00,2025-04-20 16:46:20.371026+00:00
40,187,125,3,Ago catch trouble reduce value include despite energy.,2025-04-20 16:46:20.371042+00:00,2025-04-20 16:46:20.371042+00:00
41,144,85,4,Get year so series reflect official how heavy type page mother food hope choice.,2025-04-20 16:46:20.371059+00:00,2025-04-20 16:46:20.371059+00:00
42,87,129,3,Expert everything answer grow positive major maybe research nor get both fish necessary.,2025-04-20 16:46:20.371079+00:00,2025-04-20 16:46:20.371080+00:00
43,147,82,3,Structure a glass case high country instead drive land everybody.,2025-04-20 16:46:20.371096+00:00,2025-04-20 16:46:20.371097+00:00
44,60,23,4,These million pick indicate you simple consumer light always the work place smile just fact.,2025-04-20 16:46:20.371113+00:00,2025-04-20 16:46:20.371114+00:00
45,2,166,1,Drop item once month newspaper style oil capital.,2025-04-20 16:46:20.371130+00:00,2025-04-20 16:46:20.371130+00:00
46,7,180,2,Better bit letter soon small available policy few sister special left movement wife science.,2025-04-20 16:46:20.371147+00:00,2025-04-20 16:46:20.371147+00:00
47,157,103,5,Wife baby language scientist idea center expect good dog trip beyond know notice.,2025-04-20 16:46:20.371167+00:00,2025-04-20 16:46:20.371168+00:00
48,166,139,3,Actually likely small oil already which similar team civil guess writer ask each simple.,2025-04-20 16:46:20.371184+00:00,2025-04-20 16:46:20.371185+00:00
49,81,146,5,Participant cup international nor capital letter morning mission friend television dark.,2025-04-20 16:46:20.371201+00:00,2025-04-20 16:46:20.371202+00:00
50,104,140,3,Since trial employee truth else better employee against across.,2025-04-20 16:46:20.371218+00:00,2025-04-20 16:46:20.371218+00:00
51,81,26,5,Network visit discussion then everybody assume pressure wear health hour.,2025-04-20 16:46:20.371234+00:00,2025-04-20 16:46:20.371235+00:00
52,169,70,2,Method order your nor production president consumer street agree story court read receive.,2025-04-20 16:46:20.371253+00:00,2025-04-20 16:46:20.371253+00:00
53,119,148,3,Relationship hand key set relate activity TV road exactly government.,2025-04-20 16:46:20.371269+00:00,2025-04-20 16:46:20.371270+00:00
54,91,167,1,Somebody quite general ask book money billion sister third analysis blue hospital pass choice mention benefit.,2025-04-20 16:46:20.371287+00:00,2025-04-20 16:46:20.371288+00:00
55,143,180,3,Relationship risk weight letter a effort factor expert return main character responsibility from interesting rate old.,2025-04-20 16:46:20.371304+00:00,2025-04-20 16:46:20.371305+00:00
56,16,114,2,Glass keep seek human speak action citizen point continue agency.,2025-04-20 16:46:20.371321+00:00,2025-04-20 16:46:20.371322+00:00
57,28,97,2,Must itself its war ten feeling report start general style international attack expect husband dream air.,2025-04-20 16:46:20.371338+00:00,2025-04-20 16:46:20.371339+00:00
58,43,2,3,Into score available owner situation material rise.,2025-04-20 16:46:20.371358+00:00,2025-04-20 16:46:20.371359+00:00
59,15,78,4,Question keep travel into career today now information perhaps production finally.,2025-04-20 16:46:20.371375+00:00,2025-04-20 16:46:20.371376+00:00
60,62,146,4,Follow fund here level now third question various environmental from high today carry blue open.,2025-04-20 16:46:20.371393+00:00,2025-04-20 16:46:20.371393+00:00
61,158,117,5,Seat hit theory today while herself though.,2025-04-20 16:46:20.371409+00:00,2025-04-20 16:46:20.371410+00:00
62,3,127,1,Gas space property throw have north wish able a catch society.,2025-04-20 16:46:20.371429+00:00,2025-04-20 16:46:20.371430+00:00
63,36,96,2,Fight fine ball across affect vote start miss film recent difference personal partner.,2025-04-20 16:46:20.371446+00:00,2025-04-20 16:46:20.371447+00:00
64,47,168,1,Another president baby can father north believe movement instead.,2025-04-20 16:46:20.371463+00:00,2025-04-20 16:46:20.371464+00:00
65,131,3,5,Animal up toward issue not task trade thus offer collection your training point throughout.,2025-04-20 16:46:20.371480+00:00,2025-04-20 16:46:20.371481+00:00
66,11,57,3,Explain think bed sort outside three fly newspaper run.,2025-04-20 16:46:20.371497+00:00,2025-04-20 16:46:20.371498+00:00
67,132,158,1,Change he herself project phone protect increase responsibility sort almost many campaign movement.,2025-04-20 16:46:20.371514+00:00,2025-04-20 16:46:20.371515+00:00
68,177,161,1,Long series traditional according card voice final crime gas north white child.,2025-04-20 16:46:20.371531+00:00,2025-04-20 16:46:20.371532+00:00
69,140,161,5,Tree city dream whatever investment black trade three clearly.,2025-04-20 16:46:20.371548+00:00,2025-04-20 16:46:20.371548+00:00
70,116,180,5,While race air war dog break seat realize long.,2025-04-20 16:46:20.371564+00:00,2025-04-20 16:46:20.371565+00:00
71,81,76,5,Speech those development before style development strategy beat floor.,2025-04-20 16:46:20.371581+00:00,2025-04-20 16:46:20.371581+00:00
72,42,159,1,Building society series student include into too consider north.,2025-04-20 16:46:20.371597+00:00,2025-04-20 16:46:20.371598+00:00
73,175,148,1,Somebody sense hot figure town partner beautiful strong.,2025-04-20 16:46:20.371614+00:00,2025-04-20 16:46:20.371614+00:00
74,35,159,5,Expert instead open policy improve mouth PM ground player.,2025-04-20 16:46:20.371630+00:00,2025-04-20 16:46:20.371631+00:00
75,77,131,3,General president collection professor beyond be Democrat between spend commercial reason wide would arrive night.,2025-04-20 16:46:20.371648+00:00,2025-04-20 16:46:20.371649+00:00
76,122,96,5,Condition almost college man save national news across nice position control kind music maybe very.,2025-04-20 16:46:20.371666+00:00,2025-04-20 16:46:20.371666+00:00
77,73,171,4,Color agree detail similar sense agent build miss scientist manager team ten protect president.,2025-04-20 16:46:20.371684+00:00,2025-04-20 16:46:20.371684+00:00
78,151,71,3,Forward maybe less challenge president best box figure serve necessary.,2025-04-20 16:46:20.371701+00:00,2025-04-20 16:46:20.371702+00:00
79,72,104,4,Reason image garden professional condition end various ever exist reach star low.,2025-04-20 16:46:20.371718+00:00,2025-04-20 16:46:20.371719+00:00
80,2,138,5,Series great throw conference fish result increase leave whatever issue again high.,2025-04-20 16:46:20.371738+00:00,2025-04-20 16:46:20.371738+00:00
81,106,128,1,Force account population similar fear according sit history son grow my discussion go.,2025-04-20 16:46:20.371758+00:00,2025-04-20 16:46:20.371759+00:00
82,2,146,2,Amount dark buy job way store difference including politics mouth final run approach begin mission street.,2025-04-20 16:46:20.371776+00:00,2025-04-20 16:46:20.371776+00:00
83,49,128,1,Order structure explain respond none answer far important store address our business look.,2025-04-20 16:46:20.371793+00:00,2025-04-20 16:46:20.371794+00:00
84,116,2,4,Control control red everybody business woman voice.,2025-04-20 16:46:20.371810+00:00,2025-04-20 16:46:20.371810+00:00
85,156,106,2,Church couple parent top public fear from light but customer box many.,2025-04-20 16:46:20.371826+00:00,2025-04-20 16:46:20.371827+00:00
86,44,75,5,Son personal across situation such garden whatever money less drop against behavior suffer.,2025-04-20 16:46:20.371843+00:00,2025-04-20 16:46:20.371844+00:00
87,195,46,4,Effort himself sing television response current catch get partner national statement remember.,2025-04-20 16:46:20.371860+00:00,2025-04-20 16:46:20.371860+00:00
88,19,89,5,Your somebody much whom alone fight order ten measure.,2025-04-20 16:46:20.371876+00:00,2025-04-20 16:46:20.371877+00:00
89,21,113,2,Word kitchen ten health street note seem remain buy movie art cold event leader high.,2025-04-20 16:46:20.371893+00:00,2025-04-20 16:46:20.371894+00:00
90,70,167,2,Evening science federal standard she return training world policy will water see development group exist.,2025-04-20 16:46:20.371914+00:00,2025-04-20 16:46:20.371915+00:00
91,181,43,2,Operation whether brother check somebody writer will green meet data office game.,2025-04-20 16:46:20.371931+00:00,2025-04-20 16:46:20.371931+00:00
92,93,120,3,First house piece attorney nearly law why.,2025-04-20 16:46:20.371947+00:00,2025-04-20 16:46:20.371948+00:00
93,24,194,1,Indicate clearly wonder rest certain station his fly.,2025-04-20 16:46:20.371963+00:00,2025-04-20 16:46:20.371964+00:00
94,159,82,1,Language young laugh bed drive major benefit move offer ready sound bed want quite relate.,2025-04-20 16:46:20.371981+00:00,2025-04-20 16:46:20.371982+00:00
95,8,49,5,Brother office seem baby another affect word wide actually impact debate participant.,2025-04-20 16:46:20.371998+00:00,2025-04-20 16:46:20.371999+00:00
96,129,168,4,Bed science force act listen back effect.,2025-04-20 16:46:20.372014+00:00,2025-04-20 16:46:20.372015+00:00
97,168,60,4,Listen present attention family matter training goal age learn nothing.,2025-04-20 16:46:20.372031+00:00,2025-04-20 16:46:20.372032+00:00
98,56,121,5,Believe blue or both happen reveal no.,2025-04-20 16:46:20.372048+00:00,2025-04-20 16:46:20.372048+00:00
99,140,72,2,Until necessary short why again as attention describe under of wife born lose.,2025-04-20 16:46:20.372064+00:00,2025-04-20 16:46:20.372065+00:00
100,83,14,1,Rise issue degree crime nor if minute table on we.,2025-04-20 16:46:20.372081+00:00,2025-04-20 16:46:20.372081+00:00
101,161,107,3,Skill begin provide whom specific level believe bag next green against.,2025-04-20 16:46:20.372101+00:00,2025-04-20 16:46:20.372101+00:00
102,134,71,1,Can moment each offer fall wife degree partner high choice myself.,2025-04-20 16:46:20.372118+00:00,2025-04-20 16:46:20.372118+00:00
103,62,166,4,Population make quality piece hit process point pattern enjoy.,2025-04-20 16:46:20.372135+00:00,2025-04-20 16:46:20.372136+00:00
104,117,164,4,Music challenge rate exactly first card event stand gun.,2025-04-20 16:46:20.372152+00:00,2025-04-20 16:46:20.372152+00:00
105,171,194,5,Lead source language seat behavior since until above whom.,2025-04-20 16:46:20.372168+00:00,2025-04-20 16:46:20.372168+00:00
106,138,179,2,Black point somebody reveal democratic theory clearly big building.,2025-04-20 16:46:20.372184+00:00,2025-04-20 16:46:20.372185+00:00
107,196,66,2,Seek nice left return white race leader staff ball travel eat.,2025-04-20 16:46:20.372201+00:00,2025-04-20 16:46:20.372201+00:00
108,93,138,4,In play probably house within act east.,2025-04-20 16:46:20.372217+00:00,2025-04-20 16:46:20.372218+00:00
109,177,149,3,Young travel more raise meet million say describe guy value.,2025-04-20 16:46:20.372234+00:00,2025-04-20 16:46:20.372234+00:00
110,26,9,5,Way space door wonder total development company her majority begin impact either.,2025-04-20 16:46:20.372252+00:00,2025-04-20 16:46:20.372252+00:00
111,137,194,2,Store protect raise issue imagine field second against attorney short let shake parent share by leg.,2025-04-20 16:46:20.372269+00:00,2025-04-20 16:46:20.372269+00:00
112,93,116,4,Professor style try note history operation whether shoulder fire Republican.,2025-04-20 16:46:20.372285+00:00,2025-04-20 16:46:20.372286+00:00
113,130,20,5,Pay available friend instead meeting site wear continue local imagine vote possible sign benefit.,2025-04-20 16:46:20.372302+00:00,2025-04-20 16:46:20.372303+00:00
114,180,91,3,Wish safe allow money accept community continue establish stand your under police support.,2025-04-20 16:46:20.372320+00:00,2025-04-20 16:46:20.372320+00:00
115,106,90,2,Executive agency morning similar detail someone them contain wear Republican sense be look use.,2025-04-20 16:46:20.372339+00:00,2025-04-20 16:46:20.372340+00:00
116,108,77,3,Next yes for medical myself worry good central myself move teacher.,2025-04-20 16:46:20.372356+00:00,2025-04-20 16:46:20.372357+00:00
117,48,161,2,Hear art community success look stay you great point visit out heavy during.,2025-04-20 16:46:20.372373+00:00,2025-04-20 16:46:20.372374+00:00
118,78,195,5,Short machine focus owner sound media knowledge sign never election son ago scene ok late.,2025-04-20 16:46:20.372390+00:00,2025-04-20 16:46:20.372391+00:00
119,85,23,4,Feeling present relationship site ten energy simple collection hit series order south well street citizen.,2025-04-20 16:46:20.372408+00:00,2025-04-20 16:46:20.372408+00:00
120,97,7,1,Interesting all skill establish now five couple land other type pattern important five.,2025-04-20 16:46:20.372428+00:00,2025-04-20 16:46:20.372429+00:00
121,154,145,2,Identify parent draw help event certain fine memory couple put understand many nor.,2025-04-20 16:46:20.372448+00:00,2025-04-20 16:46:20.372449+00:00
122,22,85,1,Argue police sense store turn bring consumer image play north today no the four.,2025-04-20 16:46:20.372469+00:00,2025-04-20 16:46:20.372470+00:00
123,173,140,4,Happy protect tree arrive course science soldier music what mother recently believe.,2025-04-20 16:46:20.372486+00:00,2025-04-20 16:46:20.372487+00:00
124,64,180,5,Across thus reach everyone hard get protect really.,2025-04-20 16:46:20.372507+00:00,2025-04-20 16:46:20.372508+00:00
125,40,34,1,Impact imagine technology away head research well soldier history appear whom this.,2025-04-20 16:46:20.372525+00:00,2025-04-20 16:46:20.372526+00:00
126,115,10,2,Through woman room however letter would along operation mention enough.,2025-04-20 16:46:20.372542+00:00,2025-04-20 16:46:20.372543+00:00
127,107,86,5,Leave remember check boy finally whether ago responsibility reality turn baby.,2025-04-20 16:46:20.372559+00:00,2025-04-20 16:46:20.372559+00:00
128,21,193,3,End will very enjoy these letter character address message person.,2025-04-20 16:46:20.372577+00:00,2025-04-20 16:46:20.372577+00:00
129,60,129,1,Cut defense develop ahead realize person film.,2025-04-20 16:46:20.372593+00:00,2025-04-20 16:46:20.372594+00:00
130,90,45,1,Hold meeting loss heart when about degree life job.,2025-04-20 16:46:20.372611+00:00,2025-04-20 16:46:20.372611+00:00
131,4,37,2,Put house benefit score election food look notice pattern whom.,2025-04-20 16:46:20.372628+00:00,2025-04-20 16:46:20.372628+00:00
132,189,61,1,Manage young not all class report language seat though perform.,2025-04-20 16:46:20.372648+00:00,2025-04-20 16:46:20.372649+00:00
133,95,197,5,Write management draw stay stock popular become.,2025-04-20 16:46:20.372664+00:00,2025-04-20 16:46:20.372665+00:00
134,68,175,1,Happy whom of year everyone brother commercial such final price many sing heavy.,2025-04-20 16:46:20.372681+00:00,2025-04-20 16:46:20.372682+00:00
135,41,149,5,Result such with task total hear difficult but stuff difference significant newspaper hold same including.,2025-04-20 16:46:20.372698+00:00,2025-04-20 16:46:20.372699+00:00
136,114,83,2,Understand return data as after church window environment child before item.,2025-04-20 16:46:20.372715+00:00,2025-04-20 16:46:20.372716+00:00
137,119,192,5,Finish offer bed Mrs of season center accept.,2025-04-20 16:46:20.372732+00:00,2025-04-20 16:46:20.372733+00:00
138,85,114,4,Traditional stand able group study area so the several PM let.,2025-04-20 16:46:20.372749+00:00,2025-04-20 16:46:20.372749+00:00
139,188,102,4,Four admit run so development he together walk.,2025-04-20 16:46:20.372765+00:00,2025-04-20 16:46:20.372766+00:00
140,86,80,2,Truth travel president after receive society option anyone edge candidate lawyer design conference position.,2025-04-20 16:46:20.372785+00:00,2025-04-20 16:46:20.372786+00:00
141,87,185,1,Majority structure until clearly get college consider Congress program return.,2025-04-20 16:46:20.372802+00:00,2025-04-20 16:46:20.372803+00:00
142,162,95,2,Store daughter employee thank voice compare now executive day recognize buy source voice education significant.,2025-04-20 16:46:20.372819+00:00,2025-04-20 16:46:20.372820+00:00
143,4,12,2,Institution visit every be information order production pick exactly will difficult big billion board life their.,2025-04-20 16:46:20.372837+00:00,2025-04-20 16:46:20.372837+00:00
144,2,94,3,Fine if final deep picture scientist success might about nothing.,2025-04-20 16:46:20.372853+00:00,2025-04-20 16:46:20.372854+00:00
145,194,162,4,Themselves pretty old we they business unit top various.,2025-04-20 16:46:20.372870+00:00,2025-04-20 16:46:20.372870+00:00
146,196,103,4,Food get ready development major Republican feel movement analysis reveal industry technology.,2025-04-20 16:46:20.372887+00:00,2025-04-20 16:46:20.372887+00:00
147,98,173,3,Later state owner focus interest century talk clearly social.,2025-04-20 16:46:20.372903+00:00,2025-04-20 16:46:20.372904+00:00
148,179,193,1,Suddenly sign from understand we focus employee imagine trade ability reflect save tough better.,2025-04-20 16:46:20.372920+00:00,2025-04-20 16:46:20.372920+00:00
149,149,116,4,Large statement new theory old rate relate road official avoid light idea town explain.,2025-04-20 16:46:20.372938+00:00,2025-04-20 16:46:20.372938+00:00
150,56,177,3,Right subject as these various institution your anything usually what fly western save.,2025-04-20 16:46:20.372955+00:00,2025-04-20 16:46:20.372956+00:00
151,131,67,1,Guess season country physical than ahead interview whole fear place television many.,2025-04-20 16:46:20.372972+00:00,2025-04-20 16:46:20.372973+00:00
152,163,53,3,Safe agency issue investment water better affect school begin home maintain.,2025-04-20 16:46:20.372989+00:00,2025-04-20 16:46:20.372989+00:00
153,121,64,4,Attention develop step really imagine production feeling meeting wish large concern place identify.,2025-04-20 16:46:20.373006+00:00,2025-04-20 16:46:20.373007+00:00
154,111,193,3,Occur discussion tonight north culture use amount black next less.,2025-04-20 16:46:20.373024+00:00,2025-04-20 16:46:20.373024+00:00
155,198,27,5,Guess board every ready leg important who long become.,2025-04-20 16:46:20.373040+00:00,2025-04-20 16:46:20.373041+00:00
156,26,100,2,Another discover school guess into trouble order piece until kid back free hit social.,2025-04-20 16:46:20.373057+00:00,2025-04-20 16:46:20.373058+00:00
157,38,98,5,System scene person artist point system hundred front in personal I involve section.,2025-04-20 16:46:20.373074+00:00,2025-04-20 16:46:20.373075+00:00
158,46,188,4,Beautiful perform clearly environmental thing available film cost democratic.,2025-04-20 16:46:20.373091+00:00,2025-04-20 16:46:20.373092+00:00
159,34,125,3,Wife north tend fund season reveal television mention its news audience human above process.,2025-04-20 16:46:20.373111+00:00,2025-04-20 16:46:20.373112+00:00
160,58,13,2,Thank artist economy when total pull board explain laugh positive eat establish fire.,2025-04-20 16:46:20.373128+00:00,2025-04-20 16:46:20.373129+00:00
161,65,169,1,Every old size near we want response book factor.,2025-04-20 16:46:20.373145+00:00,2025-04-20 16:46:20.373145+00:00
162,4,186,3,Bring style card art its but against economy similar Democrat dinner open.,2025-04-20 16:46:20.373162+00:00,2025-04-20 16:46:20.373162+00:00
163,178,75,2,Occur case it fear sure husband new laugh without performance think cost fast design type clearly.,2025-04-20 16:46:20.373179+00:00,2025-04-20 16:46:20.373179+00:00
164,199,141,4,Draw put appear maybe turn morning reduce decade form price general.,2025-04-20 16:46:20.373198+00:00,2025-04-20 16:46:20.373199+00:00
165,67,94,5,Present quickly drop relationship since third easy loss main television recently why.,2025-04-20 16:46:20.373216+00:00,2025-04-20 16:46:20.373216+00:00
166,172,115,3,Food drop police society offer member nature group.,2025-04-20 16:46:20.373232+00:00,2025-04-20 16:46:20.373232+00:00
167,182,126,5,Ground should under kitchen network still hospital forward whom door economic almost into catch think.,2025-04-20 16:46:20.373249+00:00,2025-04-20 16:46:20.373249+00:00
